{
  "$schema": "./rev_a_release.schema.json",
  "schema_version": 1,
  "release_id": "LCA1-S0-REV-A",
  "release_status": "integration_contract",
  "as_of": "2026-08-25",
  "program": {
    "product": "Suwappu S0",
    "purpose": "Host-attached lattice and Keccak accelerator for Suwappu bridge and chain verification paths",
    "linear_goal": "https://linear.app/suwappu/issue/SUW-293/goal-ship-suwappu-s0-rev-a-silicon-private-bridge-appliance",
    "boundary_issue": "https://linear.app/suwappu/issue/SUW-296/lca-t01-publish-the-rev-a-cut-list-and-shell-interface-contract",
    "package_issue": "https://linear.app/suwappu/issue/SUW-288/lca-t5-build-the-package-board-test-and-assembly-package"
  },
  "route": {
    "vendor": "ChipFoundry",
    "service": "chipIgnite",
    "shuttle": "CI2612",
    "process": "SKY130",
    "process_status": "vendor_published_not_contracted",
    "shell": {
      "name": "OpenFrame",
      "repository": "https://github.com/chipfoundry/openframe_user_project",
      "commit": "ca732a645568d89efc9db3052eadeca47c60cf4d",
      "template_tree": "043bcc404ee043bbe8a33f14ec24affb0dd3300b",
      "top_module": "openframe_project_wrapper",
      "user_area_mm2": 15.0,
      "gpio_count": 44,
      "management_cpu": false,
      "pin_order_must_match_template": true,
      "power_connection_macros": [
        "vccd1_connection",
        "vssd1_connection"
      ],
      "freeze_status": "pinned_for_smoke_test_not_vendor_accepted"
    },
    "schedule": {
      "status": "planning_snapshot_not_reservation",
      "commitment_date": "2026-10-08",
      "tapeout_date": "2026-12-07",
      "mask_release_date": "2026-12-21",
      "lot_start_date": "2027-01-04",
      "wafer_complete_date": "2027-04-24",
      "packaging_start_date": "2027-05-11",
      "board_start_date": "2027-05-20",
      "delivery_date": "2027-05-25"
    },
    "commercial_snapshot": {
      "currency": "USD",
      "base_tapeout_price": 14950,
      "commercial_sram_addon_price": 2500,
      "included_qfn_parts": 100,
      "included_m2_assemblies": 10,
      "included_evaluation_boards": 1,
      "reservation_status": "not_authorized",
      "quote_status": "not_requested",
      "contract_status": "not_executed"
    },
    "required_submission": {
      "format": "GDSII",
      "scope": "OpenFrame user project area",
      "vendor_integration": "ChipFoundry integrates the user-area GDSII with the golden OpenFrame",
      "required_checks": [
        "RTL full-chip simulation",
        "gate-level full-chip simulation",
        "macro DRC clean",
        "macro LVS clean",
        "OpenFrame wrapper pin-order match",
        "vccd1/vssd1 power connection",
        "cf precheck pass"
      ]
    }
  },
  "product_boundary": {
    "retained_functions": [
      "ML-KEM-768 and ML-DSA-65 forward and inverse 256-coefficient NTT primitives",
      "Keccak-f[1600] permutation",
      "dual-modulus add, subtract, multiply, and reduce primitives",
      "bounded host CSR and sequential stream control",
      "status, sticky error, interrupt, self-test, abort, and zeroize control",
      "32 KiB compiled SRAM baseline with a separately measured 64 KiB experiment"
    ],
    "excluded_functions": [
      "PicoRV32 or any other on-die general-purpose CPU",
      "firmware ROM or mutable microcode",
      "whole-message, whole-ciphertext, or whole-signature retention",
      "autonomous ML-KEM key generation or encapsulation",
      "autonomous ML-DSA key generation or signing",
      "complete protocol parsing, bridge policy, finality, replay protection, routing, or chain execution",
      "on-die entropy generation, key provisioning, or lifecycle fuses",
      "debug unlock, scan access, or unauthenticated factory-test mode",
      "TEE, attestation, FIPS validation, side-channel resistance, fault resistance, or production-key claims",
      "AI inference acceleration or confidential-inference performance claims"
    ],
    "host_responsibilities": [
      "standard wire-format parsing and packing",
      "algorithm sequencing around the exposed NTT and Keccak primitives",
      "all long-lived key storage and policy enforcement",
      "bridge finality, replay protection, routing, chain state, and transaction execution",
      "timeouts, retry policy, output authentication, and fail-closed handling",
      "confidential-compute isolation or cryptographic privacy protocol when private inference is offered"
    ],
    "maximum_retained_external_object_bytes": 0,
    "full_algorithm_commands_supported": false
  },
  "rtl_disposition": [
    {
      "path": "rtl/lca_butterfly.sv",
      "disposition": "retain",
      "rev_a_netlist": false,
      "action": "Keep as a bit-exact arithmetic reference and regression target; do not count it as an instantiated Rev-A block unless synthesis selects it."
    },
    {
      "path": "rtl/lca_chip_top.sv",
      "disposition": "replace",
      "rev_a_netlist": false,
      "action": "Replace the CPU/ROM/512-KiB/whole-message prototype top with the bounded OpenFrame link and accelerator-only Rev-A top."
    },
    {
      "path": "rtl/lca_host_frontend.sv",
      "disposition": "remove",
      "rev_a_netlist": false,
      "action": "Exclude from Rev-A because it retains complete protocol objects and implements the obsolete command ABI."
    },
    {
      "path": "rtl/lca_keccak_f1600.sv",
      "disposition": "retain",
      "rev_a_netlist": true,
      "action": "Retain the 24-round permutation engine; reverify reset, abort, state load/read, and zeroize through the new shell adapter."
    },
    {
      "path": "rtl/lca_modmul.sv",
      "disposition": "retain",
      "rev_a_netlist": false,
      "action": "Keep as a characterized constant-iteration reference while the integrated arithmetic lane is selected by synthesis evidence."
    },
    {
      "path": "rtl/lca_modmul_fast.sv",
      "disposition": "retain",
      "rev_a_netlist": false,
      "action": "Retain the two-cycle pipelined K2-RED/Solinas reduction as an arithmetic-lane candidate only. It is outside the E1 evidence chain and is not selected for Rev-A: no requirement IDs, no generated corpus entry, no mutation campaign, and no measured area, timing, or power. Selection requires a hardening run measured against the characterized shift-add reference."
    },
    {
      "path": "rtl/lca_ntt_accel.sv",
      "disposition": "modify",
      "rev_a_netlist": true,
      "action": "Retain the Level-3 NTT/INTT behavior and regression oracle while the synchronous compiled-SRAM physical implementation is independently hardened."
    },
    {
      "path": "rtl/lca_ntt_accel_sram22.sv",
      "disposition": "retain",
      "rev_a_netlist": false,
      "action": "SRAM22-backed two-phase NTT/INTT physical candidate. Promote into the Rev-A netlist only after core integration, pinned SKY130 STA/area evidence, and OpenFrame hardening close."
    },
    {
      "path": "rtl/lca_ntt_zetas.svh",
      "disposition": "retain",
      "rev_a_netlist": true,
      "action": "Retain generated constants and pin their generator/source hash in the physical release manifest."
    },
    {
      "path": "rtl/lca_secure_sram.sv",
      "disposition": "replace",
      "rev_a_netlist": false,
      "action": "Keep only as a behavioral simulation model; replace the silicon implementation with the selected compiled SRAM wrapper."
    },
    {
      "path": "rtl/lca_secure_sram_sram22.sv",
      "disposition": "retain",
      "rev_a_netlist": false,
      "action": "Four-bank 32-KiB SRAM22 physical candidate with registered reads and full-capacity parallel scrub. Promote only after integration and physical signoff evidence."
    },
    {
      "path": "rtl/lca_sram22_macros.sv",
      "disposition": "retain",
      "rev_a_netlist": false,
      "action": "Stable wrappers for the pinned SRAM22 physical macros plus cycle-accurate simulation fallbacks; physical promotion is controlled by the Rev-A hardening configuration."
    }
  ],
  "memory": {
    "whole_message_buffer_forbidden": true,
    "baseline": {
      "logical_capacity_bytes": 32768,
      "macro": "CF_SRAM_8192x32",
      "instances": 1,
      "words_per_instance": 8192,
      "bits_per_word": 32,
      "area_mm2_each_vendor_published": 1.34,
      "interface": "Wishbone",
      "status": "commercial_views_and_license_not_yet_acquired"
    },
    "experiment": {
      "logical_capacity_bytes": 65536,
      "macro": "CF_SRAM_8192x32",
      "instances": 2,
      "words_per_instance": 8192,
      "bits_per_word": 32,
      "area_mm2_total_vendor_published": 2.68,
      "promotion_rule": "Promote only if the same pinned OpenFrame run closes area, timing, IR/EM, and price without weakening zeroize coverage."
    },
    "zeroize": {
      "power_on_scrub_required": true,
      "full_capacity_scrub_on_tamper": true,
      "full_capacity_scrub_on_host_zeroize": true,
      "ready_blocked_until_scrub_complete": true,
      "repair_and_spare_coverage": "vendor_review_required"
    }
  },
  "shell_interface": {
    "name": "LCA-LINK-16",
    "version": "0.1",
    "electrical_domain": "3.3V CMOS pads with 1.8V core-side signals",
    "clock_source": "GPIO38 / QFN pin 22",
    "clock_domains": 1,
    "external_reset": "OpenFrame resetb_l derived from QFN pin 21",
    "data_width_bits": 16,
    "address_width_bits": 8,
    "maximum_outstanding_reads": 1,
    "request_acceptance": "Sample on the rising host clock edge when req_valid and req_ready are both high.",
    "response_acceptance": "Hold response data, rsp_last, and rsp_valid stable until rsp_valid and rsp_ready are both high on a rising edge.",
    "bus_turnaround": "The host releases host_d no later than the accepted read request edge. The chip drives host_d only while rsp_valid is asserted.",
    "address_classes": [
      {
        "range": "0x00-0x3f",
        "name": "CSR halfwords",